{
  "audit_id": "audit-1ecaf157-1139-4de7-b4a4-8df6bb829a45",
  "base_version": "v61",
  "candidate_patch": {
    "affected_lines": [
      "line_1",
      "line_2",
      "line_3",
      "line_4"
    ],
    "base_version": "v61",
    "intent_text": "i want to adjust the throughput/hr for all production lines to at least 60; set the tooling picking target for production lines 2 and 4 to retractors; and adjust the tooling picking order for production lines 1 and 3 to prioritize picking tooling other than forceps.",
    "operations": [
      {
        "op": "replace",
        "path": "/lines/line_1/manipulator_priority",
        "value": {
          "enabled": true,
          "ordered_normalized_types": [
            "FORCEPS"
          ],
          "ordered_tool_ids": [],
          "policy": "EXPLICIT_TYPE_ORDER",
          "tie_breaker": "FCFS"
        }
      },
      {
        "op": "replace",
        "path": "/lines/line_1/kpi/min_throughput_per_hour",
        "value": 60
      },
      {
        "op": "replace",
        "path": "/lines/line_2/manipulator_priority",
        "value": {
          "enabled": true,
          "ordered_normalized_types": [
            "FORCEPS"
          ],
          "ordered_tool_ids": [],
          "policy": "EXPLICIT_TYPE_ORDER",
          "tie_breaker": "FCFS"
        }
      },
      {
        "op": "replace",
        "path": "/lines/line_2/kpi/min_throughput_per_hour",
        "value": 60
      },
      {
        "op": "replace",
        "path": "/lines/line_3/manipulator_priority",
        "value": {
          "enabled": true,
          "ordered_normalized_types": [
            "FORCEPS"
          ],
          "ordered_tool_ids": [],
          "policy": "EXPLICIT_TYPE_ORDER",
          "tie_breaker": "FCFS"
        }
      },
      {
        "op": "replace",
        "path": "/lines/line_3/kpi/min_throughput_per_hour",
        "value": 60
      },
      {
        "op": "replace",
        "path": "/lines/line_4/manipulator_priority",
        "value": {
          "enabled": true,
          "ordered_normalized_types": [
            "FORCEPS"
          ],
          "ordered_tool_ids": [],
          "policy": "EXPLICIT_TYPE_ORDER",
          "tie_breaker": "FCFS"
        }
      },
      {
        "op": "replace",
        "path": "/lines/line_4/kpi/min_throughput_per_hour",
        "value": 60
      }
    ],
    "operator_id": "op_001",
    "patch_id": "patch_497feada-e9bb-4089-a599-cfc0135cf8fd",
    "reason": "test for milestone 11.5",
    "request_types": [
      "KPI_LIMIT_UPDATE",
      "TOOLING_POLICY_UPDATE",
      "MANIPULATOR_PRIORITY_UPDATE"
    ],
    "status": "REVIEWED",
    "trt_id": "trt-demo"
  },
  "candidate_summary": {
    "affected_fields": [
      "/lines/line_1/manipulator_priority",
      "/lines/line_1/kpi/min_throughput_per_hour",
      "/lines/line_2/manipulator_priority",
      "/lines/line_2/kpi/min_throughput_per_hour",
      "/lines/line_3/manipulator_priority",
      "/lines/line_3/kpi/min_throughput_per_hour",
      "/lines/line_4/manipulator_priority",
      "/lines/line_4/kpi/min_throughput_per_hour"
    ],
    "affected_lines": [
      "line_1",
      "line_2",
      "line_3",
      "line_4"
    ],
    "intent_text": "i want to adjust the throughput/hr for all production lines to at least 60; set the tooling picking target for production lines 2 and 4 to retractors; and adjust the tooling picking order for production lines 1 and 3 to prioritize picking tooling other than forceps.",
    "reason": "test for milestone 11.5"
  },
  "created_at_utc": "2026-06-22T17:41:04.949175Z",
  "current_trt_path": "/app/data/trt/current_trt.json",
  "operator_decision": {
    "comment": "APPROVE: Test for the Milestone 11.5",
    "decision": "APPROVE",
    "operator_id": "op_001",
    "timestamp_utc": "2026-06-22T17:41:05.124917Z"
  },
  "operator_id": "op_001",
  "patch_id": "patch_497feada-e9bb-4089-a599-cfc0135cf8fd",
  "previous_trt_version": "v61",
  "release_id": "rel_7b4e4978-fe73-4170-a6ca-abf6864efca0",
  "status": "RELEASED",
  "trt_id": "trt-demo",
  "trt_version": "v62",
  "updated_at_utc": "2026-06-22T17:41:05.124917Z",
  "validation_results_at_prepare": {
    "base_version": true,
    "path_whitelist": true,
    "readonly": true,
    "schema": true,
    "semantic": true
  },
  "version_path": "/app/data/trt_versions/trt-demo_v62.json"
}
