{
  "audit_id": "audit-59a2dc54-11e6-4461-8c13-04d7e71ab30e",
  "base_version": "v115",
  "candidate_patch": {
    "affected_lines": [
      "line_1",
      "line_2",
      "line_3",
      "line_4"
    ],
    "base_version": "v115",
    "dry_run_only": false,
    "intent_text": "set all production lines throughput/hr to at least 90 and keep placement verification strict and set simulated tooling count per production line to 2 (M12 full test target total simulated tooling: 8)",
    "message": "The candidate patch passed validation. It will apply the requested composite changes across 2 sub-requests. Please approve, reject, or request revision.",
    "operations": [
      {
        "op": "replace",
        "path": "/lines/line_1/kpi/min_throughput_per_hour",
        "value": 90
      },
      {
        "op": "replace",
        "path": "/lines/line_2/kpi/min_throughput_per_hour",
        "value": 90
      },
      {
        "op": "replace",
        "path": "/lines/line_3/kpi/min_throughput_per_hour",
        "value": 90
      },
      {
        "op": "replace",
        "path": "/lines/line_4/kpi/min_throughput_per_hour",
        "value": 90
      }
    ],
    "operator_id": "op_001",
    "patch_id": "patch-1783100313838",
    "reason": "M12 manual comparison test TC3-fixture_our_setup_i_03",
    "request_types": [
      "KPI_LIMIT_UPDATE",
      "SIMULATION_CONFIG_UPDATE"
    ],
    "simulation_config_updates": {
      "add_reference_number": 2
    },
    "status": "REVIEWED",
    "sub_requests": [
      {
        "affected_lines": [
          "line_1",
          "line_2",
          "line_3",
          "line_4"
        ],
        "kpi_updates": {
          "min_throughput_per_hour": 90
        },
        "operation_paths": [
          "/lines/line_1/kpi/min_throughput_per_hour",
          "/lines/line_2/kpi/min_throughput_per_hour",
          "/lines/line_3/kpi/min_throughput_per_hour",
          "/lines/line_4/kpi/min_throughput_per_hour"
        ],
        "request_type": "KPI_LIMIT_UPDATE",
        "request_types": [
          "KPI_LIMIT_UPDATE"
        ],
        "simulation_config_updates": {},
        "target_lines": [],
        "target_scope": "ALL_LINES"
      },
      {
        "affected_lines": [
          "line_1",
          "line_2",
          "line_3",
          "line_4"
        ],
        "operation_paths": [],
        "request_type": "SIMULATION_CONFIG_UPDATE",
        "request_types": [
          "SIMULATION_CONFIG_UPDATE"
        ],
        "simulation_config_updates": {
          "add_reference_number": 2
        },
        "target_lines": [],
        "target_scope": "ALL_LINES"
      }
    ],
    "trt_id": "trt-demo"
  },
  "candidate_summary": {
    "affected_fields": [
      "/lines/line_1/kpi/min_throughput_per_hour",
      "/lines/line_2/kpi/min_throughput_per_hour",
      "/lines/line_3/kpi/min_throughput_per_hour",
      "/lines/line_4/kpi/min_throughput_per_hour"
    ],
    "affected_lines": [
      "line_1",
      "line_2",
      "line_3",
      "line_4"
    ],
    "intent_text": "set all production lines throughput/hr to at least 90 and keep placement verification strict and set simulated tooling count per production line to 2 (M12 full test target total simulated tooling: 8)",
    "reason": "M12 manual comparison test TC3-fixture_our_setup_i_03"
  },
  "created_at_utc": "2026-07-03T17:38:36.629239Z",
  "current_trt_path": "/app/data/trt/current_trt.json",
  "operator_decision": {
    "comment": "M12 manual comparison test TC3-fixture_our_setup_i_03",
    "decision": "APPROVE",
    "operator_id": "op_001",
    "timestamp_utc": "2026-07-03T17:38:36.839209Z"
  },
  "operator_id": "op_001",
  "patch_id": "patch-1783100313838",
  "previous_trt_version": "v115",
  "release_id": "rel_32ffe6c3-68b8-4326-9458-3610c704004c",
  "status": "RELEASED",
  "trt_id": "trt-demo",
  "trt_version": "v116",
  "updated_at_utc": "2026-07-03T17:38:36.839209Z",
  "validation_results_at_prepare": {
    "base_version": true,
    "path_whitelist": true,
    "readonly": true,
    "schema": true,
    "semantic": true
  },
  "version_path": "/app/data/trt_versions/trt-demo_v116.json"
}
