{
  "audit_id": "audit-441f93eb-b586-4ec8-a188-b3af71ace06f",
  "base_version": "v9",
  "candidate_patch": {
    "base_version": "v9",
    "intent_text": "Line 1 should prioritize Trauma Set. Exclude forceps if possible. If entanglement occurs, continue feasible tasks when safe.",
    "operations": [
      {
        "op": "replace",
        "path": "/lines/line_1/goal",
        "value": "TRAUMA_SET_PRIORITY"
      },
      {
        "op": "replace",
        "path": "/lines/line_1/excluded_instruments",
        "value": [
          "FORCEPS"
        ]
      }
    ],
    "operator_id": "op_001",
    "patch_id": "patch-1780317978729",
    "reason": "urgent trauma set deadline",
    "status": "REVIEWED",
    "trt_id": "trt-demo"
  },
  "candidate_summary": {
    "affected_fields": [
      "/lines/line_1/goal",
      "/lines/line_1/excluded_instruments"
    ],
    "affected_lines": [
      "line_1"
    ],
    "intent_text": "Line 1 should prioritize Trauma Set. Exclude forceps if possible. If entanglement occurs, continue feasible tasks when safe.",
    "reason": "urgent trauma set deadline"
  },
  "created_at_utc": "2026-06-01T12:46:38.559869Z",
  "operator_decision": {
    "comment": "Test for the Milestone 6.5C",
    "decision": "REQUEST_REVISION",
    "operator_id": "op_001",
    "timestamp_utc": "2026-06-01T12:46:38.586140Z"
  },
  "operator_id": "op_001",
  "patch_id": "patch-1780317978729",
  "release_id": "rel_5779f0ab-1058-4cc7-a6f6-adf4db1e22d2",
  "status": "NEEDS_REVISION",
  "trt_id": "trt-demo",
  "updated_at_utc": "2026-06-01T12:46:38.586140Z",
  "validation_results_at_prepare": {
    "base_version": true,
    "path_whitelist": true,
    "readonly": true,
    "schema": true,
    "semantic": true
  }
}