{
  "audit_id": "audit-f2469b6f-0839-4d47-a9e6-9b3fc4c09745",
  "base_version": "v170",
  "candidate_patch": {
    "affected_lines": [
      "line_1",
      "line_2",
      "line_3",
      "line_4"
    ],
    "base_version": "v170",
    "dry_run_only": false,
    "intent_text": "today there are two production lines. my arrival time is 4 seconds, the time required to resolve the tangling issue is 5 seconds, and the recovery time is 0.5 seconds. in the event of an anomaly, pls configure the logic so that continue until i arrive at the production line. the allow overlap ratio is 0.9. adjust the throughput/hr for all production lines to at least 85; set the tooling picking target for production lines 2 to knife handle; and adjust the tooling picking order for production lines 1 to prioritize picking tooling other than ent tooling set.",
    "message": "The candidate patch passed validation. It will apply the requested composite changes across 4 sub-requests. Please approve, reject, or request revision.",
    "operations": [
      {
        "op": "replace",
        "path": "/lines/line_1/kpi/min_throughput_per_hour",
        "value": 85
      },
      {
        "op": "replace",
        "path": "/lines/line_2/kpi/min_throughput_per_hour",
        "value": 85
      },
      {
        "op": "replace",
        "path": "/lines/line_3/kpi/min_throughput_per_hour",
        "value": 85
      },
      {
        "op": "replace",
        "path": "/lines/line_4/kpi/min_throughput_per_hour",
        "value": 85
      },
      {
        "op": "replace",
        "path": "/lines/line_2/manipulator_priority",
        "value": {
          "enabled": true,
          "ordered_normalized_types": [],
          "ordered_tool_ids": [],
          "policy": "FCFS",
          "tie_breaker": "FCFS"
        }
      },
      {
        "op": "replace",
        "path": "/lines/line_2/tooling_policy/required_scope",
        "value": "SELECTED_TOOLING"
      },
      {
        "op": "replace",
        "path": "/lines/line_1/manipulator_priority",
        "value": {
          "enabled": true,
          "ordered_normalized_types": [],
          "ordered_tool_ids": [],
          "policy": "FCFS",
          "tie_breaker": "FCFS"
        }
      }
    ],
    "operator_id": "op_001",
    "patch_id": "patch-1784394576634",
    "reason": "testing",
    "request_types": [
      "SIMULATION_CONFIG_UPDATE",
      "KPI_LIMIT_UPDATE",
      "TOOLING_POLICY_UPDATE",
      "MANIPULATOR_PRIORITY_UPDATE"
    ],
    "simulation_config_updates": {
      "episode_success_requires_reset_cycles": null,
      "fix_duration": 3,
      "num_envs": 2,
      "resume_delay": 1,
      "travel_time": 1
    },
    "status": "REVIEWED",
    "sub_requests": [
      {
        "affected_lines": [
          "line_1",
          "line_2",
          "line_3",
          "line_4"
        ],
        "operation_paths": [],
        "request_type": "SIMULATION_CONFIG_UPDATE",
        "request_types": [
          "SIMULATION_CONFIG_UPDATE"
        ],
        "simulation_config_updates": {
          "episode_success_requires_reset_cycles": null,
          "fix_duration": 3,
          "num_envs": 2,
          "resume_delay": 1,
          "travel_time": 1
        },
        "target_lines": [],
        "target_scope": "ALL_LINES"
      },
      {
        "affected_lines": [
          "line_1",
          "line_2",
          "line_3",
          "line_4"
        ],
        "kpi_updates": {
          "min_throughput_per_hour": 85
        },
        "operation_paths": [
          "/lines/line_1/kpi/min_throughput_per_hour",
          "/lines/line_2/kpi/min_throughput_per_hour",
          "/lines/line_3/kpi/min_throughput_per_hour",
          "/lines/line_4/kpi/min_throughput_per_hour"
        ],
        "request_type": "KPI_LIMIT_UPDATE",
        "request_types": [
          "KPI_LIMIT_UPDATE"
        ],
        "simulation_config_updates": {},
        "target_lines": [],
        "target_scope": "ALL_LINES"
      },
      {
        "abnormal_strategy": null,
        "affected_lines": [
          "line_2"
        ],
        "clarification_questions": null,
        "manipulator_priority": {
          "enabled": true
        },
        "operation_paths": [
          "/lines/line_2/manipulator_priority",
          "/lines/line_2/tooling_policy/required_scope"
        ],
        "request_type": "TOOLING_POLICY_UPDATE",
        "request_types": [
          "TOOLING_POLICY_UPDATE"
        ],
        "simulation_config_updates": {},
        "target_lines": [
          "line_2"
        ],
        "target_scope": "SINGLE_LINE",
        "tooling_policy": {
          "required_scope": "SELECTED_TOOLING"
        }
      },
      {
        "abnormal_strategy": null,
        "affected_lines": [
          "line_1"
        ],
        "clarification_questions": null,
        "manipulator_priority": {
          "enabled": true
        },
        "operation_paths": [
          "/lines/line_1/manipulator_priority"
        ],
        "request_type": "MANIPULATOR_PRIORITY_UPDATE",
        "request_types": [
          "MANIPULATOR_PRIORITY_UPDATE"
        ],
        "simulation_config_updates": {},
        "target_lines": [
          "line_1"
        ],
        "target_scope": "SINGLE_LINE"
      }
    ],
    "trt_id": "trt-demo"
  },
  "candidate_summary": {
    "affected_fields": [
      "/lines/line_1/kpi/min_throughput_per_hour",
      "/lines/line_2/kpi/min_throughput_per_hour",
      "/lines/line_3/kpi/min_throughput_per_hour",
      "/lines/line_4/kpi/min_throughput_per_hour",
      "/lines/line_2/manipulator_priority",
      "/lines/line_2/tooling_policy/required_scope",
      "/lines/line_1/manipulator_priority"
    ],
    "affected_lines": [
      "line_1",
      "line_2",
      "line_3",
      "line_4"
    ],
    "intent_text": "today there are two production lines. my arrival time is 4 seconds, the time required to resolve the tangling issue is 5 seconds, and the recovery time is 0.5 seconds. in the event of an anomaly, pls configure the logic so that continue until i arrive at the production line. the allow overlap ratio is 0.9. adjust the throughput/hr for all production lines to at least 85; set the tooling picking target for production lines 2 to knife handle; and adjust the tooling picking order for production lines 1 to prioritize picking tooling other than ent tooling set.",
    "reason": "testing"
  },
  "created_at_utc": "2026-07-18T17:09:43.696067Z",
  "current_trt_path": "/app/data/trt/current_trt.json",
  "operator_decision": {
    "comment": "Testing",
    "decision": "APPROVE",
    "operator_id": "op_001",
    "timestamp_utc": "2026-07-18T17:09:43.977156Z"
  },
  "operator_id": "op_001",
  "patch_id": "patch-1784394576634",
  "previous_trt_version": "v170",
  "release_id": "rel_b6fa14e9-b437-4cb3-97f4-c64b1d4aae4c",
  "status": "RELEASED",
  "trt_id": "trt-demo",
  "trt_version": "v171",
  "updated_at_utc": "2026-07-18T17:09:43.977156Z",
  "validation_results_at_prepare": {
    "base_version": true,
    "path_whitelist": true,
    "readonly": true,
    "schema": true,
    "semantic": true
  },
  "version_path": "/app/data/trt_versions/trt-demo_v171.json"
}
