{
  "audit_id": "audit-33c68056-ef92-4e0f-9a0b-cf7372dc1279",
  "base_version": "v103",
  "candidate_patch": {
    "affected_lines": [
      "line_1",
      "line_2",
      "line_3",
      "line_4"
    ],
    "base_version": "v103",
    "dry_run_only": false,
    "intent_text": "set line 1 tooling picking target to knife handle and set simulated tooling count per production line to 5 and run this as a two-production-line simulation (M12 full test target total simulated tooling: 10)",
    "message": "The candidate patch passed validation. It will apply the requested composite changes across 2 sub-requests. Please approve, reject, or request revision.",
    "operations": [
      {
        "op": "replace",
        "path": "/lines/line_1/manipulator_priority",
        "value": {
          "enabled": true,
          "ordered_normalized_types": [],
          "ordered_tool_ids": [],
          "policy": "FCFS",
          "tie_breaker": "FCFS"
        }
      },
      {
        "op": "replace",
        "path": "/lines/line_1/tooling_policy/required_scope",
        "value": "SELECTED_TOOLING"
      }
    ],
    "operator_id": "op_001",
    "patch_id": "patch-1783095563073",
    "reason": "m12 seed",
    "request_types": [
      "TOOLING_POLICY_UPDATE",
      "SIMULATION_CONFIG_UPDATE"
    ],
    "simulation_config_updates": {
      "add_reference_number": 5,
      "num_envs": 2
    },
    "status": "REVIEWED",
    "sub_requests": [
      {
        "abnormal_strategy": null,
        "affected_lines": [
          "line_1"
        ],
        "clarification_questions": null,
        "manipulator_priority": {
          "enabled": true
        },
        "operation_paths": [
          "/lines/line_1/manipulator_priority",
          "/lines/line_1/tooling_policy/required_scope"
        ],
        "request_type": "TOOLING_POLICY_UPDATE",
        "request_types": [
          "TOOLING_POLICY_UPDATE"
        ],
        "simulation_config_updates": {},
        "target_lines": [
          "line_1"
        ],
        "target_scope": "SINGLE_LINE",
        "tooling_policy": {
          "required_scope": "SELECTED_TOOLING"
        }
      },
      {
        "affected_lines": [
          "line_1",
          "line_2",
          "line_3",
          "line_4"
        ],
        "clarification_questions": null,
        "operation_paths": [],
        "request_type": "SIMULATION_CONFIG_UPDATE",
        "request_types": [
          "SIMULATION_CONFIG_UPDATE"
        ],
        "simulation_config_updates": {
          "add_reference_number": 5,
          "num_envs": 2
        },
        "target_lines": [],
        "target_scope": "ALL_LINES"
      }
    ],
    "trt_id": "trt-demo"
  },
  "candidate_summary": {
    "affected_fields": [
      "/lines/line_1/manipulator_priority",
      "/lines/line_1/tooling_policy/required_scope"
    ],
    "affected_lines": [
      "line_1"
    ],
    "intent_text": "set line 1 tooling picking target to knife handle and set simulated tooling count per production line to 5 and run this as a two-production-line simulation (M12 full test target total simulated tooling: 10)",
    "reason": "m12 seed"
  },
  "created_at_utc": "2026-07-03T16:19:26.704125Z",
  "current_trt_path": "/app/data/trt/current_trt.json",
  "operator_decision": {
    "comment": "M12 manual comparison test TC1-INTENT_033",
    "decision": "APPROVE",
    "operator_id": "op_001",
    "timestamp_utc": "2026-07-03T16:19:26.853799Z"
  },
  "operator_id": "op_001",
  "patch_id": "patch-1783095563073",
  "previous_trt_version": "v103",
  "release_id": "rel_a5ffbb58-84cd-439c-91f1-798e85e1092b",
  "status": "RELEASED",
  "trt_id": "trt-demo",
  "trt_version": "v104",
  "updated_at_utc": "2026-07-03T16:19:26.853799Z",
  "validation_results_at_prepare": {
    "base_version": true,
    "path_whitelist": true,
    "readonly": true,
    "schema": true,
    "semantic": true
  },
  "version_path": "/app/data/trt_versions/trt-demo_v104.json"
}
