{
  "audit_id": "audit-9e236b31-4c30-46fd-9fbd-9b34bcaf9391",
  "base_version": "v43",
  "candidate_patch": {
    "affected_lines": [
      "line_1",
      "line_3"
    ],
    "base_version": "v43",
    "intent_text": "prioritize the adjustment of production lines 1 and 3 to focus on the ent surgical tooling set, and adjust the number of tooling on the production line so that only 6 remain Clarification: i mean the robots on lines 1 and 3 pick ENT-required tools first",
    "message": "The candidate patch passed validation. It will set line_1, line_3 to target the ENT_SURGICAL_TOOLING_SET, make their robots pick ENT-required tools first, and set add_reference_number to 6 for the full-system simulation. Please approve, reject, or request revision.",
    "operations": [
      {
        "op": "replace",
        "path": "/lines/line_1/manipulator_priority",
        "value": {
          "enabled": true,
          "ordered_normalized_types": [],
          "ordered_tool_ids": [],
          "policy": "REQUIRED_FIRST",
          "tie_breaker": "FCFS"
        }
      },
      {
        "op": "replace",
        "path": "/lines/line_1/target_set_id",
        "value": "ENT_SURGICAL_TOOLING_SET"
      },
      {
        "op": "replace",
        "path": "/lines/line_3/manipulator_priority",
        "value": {
          "enabled": true,
          "ordered_normalized_types": [],
          "ordered_tool_ids": [],
          "policy": "REQUIRED_FIRST",
          "tie_breaker": "FCFS"
        }
      },
      {
        "op": "replace",
        "path": "/lines/line_3/target_set_id",
        "value": "ENT_SURGICAL_TOOLING_SET"
      }
    ],
    "operator_id": "op_001",
    "patch_id": "patch_dfd0e296-977b-456f-9d95-16cf71985665",
    "reason": "test for milestone 10",
    "request_types": [
      "SIMULATION_CONFIG_UPDATE",
      "MANIPULATOR_PRIORITY_UPDATE",
      "TOOLING_POLICY_UPDATE"
    ],
    "simulation_config_updates": {
      "add_reference_number": 6
    },
    "status": "REVIEWED",
    "trt_id": "trt-demo"
  },
  "candidate_summary": {
    "affected_fields": [
      "/lines/line_1/manipulator_priority",
      "/lines/line_1/target_set_id",
      "/lines/line_3/manipulator_priority",
      "/lines/line_3/target_set_id"
    ],
    "affected_lines": [
      "line_1",
      "line_3"
    ],
    "intent_text": "prioritize the adjustment of production lines 1 and 3 to focus on the ent surgical tooling set, and adjust the number of tooling on the production line so that only 6 remain Clarification: i mean the robots on lines 1 and 3 pick ENT-required tools first",
    "reason": "test for milestone 10"
  },
  "created_at_utc": "2026-06-21T13:25:39.511254Z",
  "current_trt_path": "/app/data/trt/current_trt.json",
  "operator_decision": {
    "comment": "Test for the Milestone 10",
    "decision": "APPROVE",
    "operator_id": "op_001",
    "timestamp_utc": "2026-06-21T13:25:39.587012Z"
  },
  "operator_id": "op_001",
  "patch_id": "patch_dfd0e296-977b-456f-9d95-16cf71985665",
  "previous_trt_version": "v43",
  "release_id": "rel_1a144e7e-a305-414a-bbe6-9e73fd74629d",
  "status": "RELEASED",
  "trt_id": "trt-demo",
  "trt_version": "v44",
  "updated_at_utc": "2026-06-21T13:25:39.587012Z",
  "validation_results_at_prepare": {
    "base_version": true,
    "path_whitelist": true,
    "readonly": true,
    "schema": true,
    "semantic": true
  },
  "version_path": "/app/data/trt_versions/trt-demo_v44.json"
}
