{
  "audit_id": "audit-6dfb0014-1b76-4f64-a948-4b66464371f7",
  "base_version": "v120",
  "candidate_patch": {
    "affected_lines": [
      "line_1",
      "line_2"
    ],
    "base_version": "v120",
    "dry_run_only": false,
    "intent_text": "run a limited two-line simulation and preserve required reset cycle completion and set simulated tooling count per production line to 5 (M12 full test target total simulated tooling: 10)",
    "message": "The candidate patch passed validation. It will apply the requested composite changes across 2 sub-requests. Please approve, reject, or request revision.",
    "operations": [],
    "operator_id": "op_001",
    "patch_id": "patch-1783101962936",
    "reason": "M12 manual comparison test TC3-fixture_our_setup_ii_03",
    "request_types": [
      "SIMULATION_CONFIG_UPDATE"
    ],
    "simulation_config_updates": {
      "add_reference_number": 5,
      "episode_success_requires_reset_cycles": null,
      "num_envs": 2
    },
    "status": "REVIEWED",
    "sub_requests": [
      {
        "affected_lines": [
          "line_1",
          "line_2"
        ],
        "operation_paths": [],
        "request_type": "SIMULATION_CONFIG_UPDATE",
        "request_types": [
          "SIMULATION_CONFIG_UPDATE"
        ],
        "simulation_config_updates": {
          "add_reference_number": 5,
          "episode_success_requires_reset_cycles": null,
          "num_envs": 2
        },
        "target_lines": [
          "line_1",
          "line_2"
        ],
        "target_scope": "MULTIPLE_LINES"
      },
      {
        "affected_lines": [
          "line_1",
          "line_2"
        ],
        "operation_paths": [],
        "request_type": "SIMULATION_CONFIG_UPDATE",
        "request_types": [
          "SIMULATION_CONFIG_UPDATE"
        ],
        "simulation_config_updates": {
          "add_reference_number": 5
        },
        "target_lines": [
          "line_1",
          "line_2"
        ],
        "target_scope": "MULTIPLE_LINES"
      }
    ],
    "trt_id": "trt-demo"
  },
  "candidate_summary": {
    "affected_fields": [],
    "affected_lines": [],
    "intent_text": "run a limited two-line simulation and preserve required reset cycle completion and set simulated tooling count per production line to 5 (M12 full test target total simulated tooling: 10)",
    "reason": "M12 manual comparison test TC3-fixture_our_setup_ii_03"
  },
  "created_at_utc": "2026-07-03T18:06:06.703812Z",
  "current_trt_path": "/app/data/trt/current_trt.json",
  "operator_decision": {
    "comment": "M12 manual comparison test TC3-fixture_our_setup_ii_03",
    "decision": "APPROVE",
    "operator_id": "op_001",
    "timestamp_utc": "2026-07-03T18:06:06.882425Z"
  },
  "operator_id": "op_001",
  "patch_id": "patch-1783101962936",
  "previous_trt_version": "v120",
  "release_id": "rel_f6b24a26-2a42-4337-b94b-6c3abadba0e8",
  "status": "RELEASED",
  "trt_id": "trt-demo",
  "trt_version": "v121",
  "updated_at_utc": "2026-07-03T18:06:06.882425Z",
  "validation_results_at_prepare": {
    "base_version": true,
    "path_whitelist": true,
    "readonly": true,
    "schema": true,
    "semantic": true
  },
  "version_path": "/app/data/trt_versions/trt-demo_v121.json"
}
