{
  "audit_id": "audit-8921ae38-634b-4ec6-bb65-290a4e1b08af",
  "base_version": "v23",
  "candidate_patch": {
    "base_version": "v23",
    "intent_text": "set all tooling required by each production line to required, with no deadline and no maximum downtime limit for each production line.",
    "operations": [
      {
        "op": "replace",
        "path": "/lines/line_1/tooling_policy/all_required",
        "value": true
      },
      {
        "op": "replace",
        "path": "/lines/line_1/kpi/deadline_minutes",
        "value": null
      },
      {
        "op": "replace",
        "path": "/lines/line_1/kpi/max_downtime_seconds",
        "value": null
      },
      {
        "op": "replace",
        "path": "/lines/line_2/tooling_policy/all_required",
        "value": true
      },
      {
        "op": "replace",
        "path": "/lines/line_2/kpi/deadline_minutes",
        "value": null
      },
      {
        "op": "replace",
        "path": "/lines/line_2/kpi/max_downtime_seconds",
        "value": null
      }
    ],
    "operator_id": "op_001",
    "patch_id": "patch-1780390469784",
    "reason": "to conduct testing for milestone 6.5d",
    "status": "REVIEWED",
    "trt_id": "trt-demo"
  },
  "candidate_summary": {
    "affected_fields": [
      "/lines/line_1/tooling_policy/all_required",
      "/lines/line_1/kpi/deadline_minutes",
      "/lines/line_1/kpi/max_downtime_seconds",
      "/lines/line_2/tooling_policy/all_required",
      "/lines/line_2/kpi/deadline_minutes",
      "/lines/line_2/kpi/max_downtime_seconds"
    ],
    "affected_lines": [
      "line_1",
      "line_2"
    ],
    "intent_text": "set all tooling required by each production line to required, with no deadline and no maximum downtime limit for each production line.",
    "reason": "to conduct testing for milestone 6.5d"
  },
  "created_at_utc": "2026-06-02T08:54:39.733864Z",
  "operator_decision": {
    "comment": "Test for the Milestone 6.5D",
    "decision": "APPROVE",
    "operator_id": "op_001",
    "timestamp_utc": "2026-06-02T08:54:39.774800Z"
  },
  "operator_id": "op_001",
  "patch_id": "patch-1780390469784",
  "release_id": "rel_4133cbfc-560f-447b-8829-891f94c37152",
  "status": "RELEASED",
  "trt_id": "trt-demo",
  "updated_at_utc": "2026-06-02T08:54:39.774800Z",
  "validation_results_at_prepare": {
    "base_version": true,
    "path_whitelist": true,
    "readonly": true,
    "schema": true,
    "semantic": true
  }
}